{
  "schema_family": "screenplay-units",
  "schema_version": "1.0.0",
  "project_id": "PRJ-008",
  "title": "같은 하루",
  "source_truth_classification": "ORIGINAL_FICTION",
  "scenes": [
    {
      "scene_id": "SCN-01",
      "order": 1,
      "title": "먼저 도착한 사람",
      "time_layer": "PRESENT",
      "location_id": "LOC-02",
      "segment_ids": [
        "SEG-001"
      ],
      "context": {
        "location_description": "약속 카페. 창가 두 자리, 출입문이 보이는 테이블. 다른 손님의 얼굴이나 목소리는 등장하지 않는다.",
        "time_description": "사건 당일 현재 오전 11시 30분. 서윤은 정오 약속보다 먼저 도착했다.",
        "previous_scene_id": null,
        "background_music_description": "대화와 생활 소리가 선명하게 들리도록 음악을 두지 않는다.",
        "sound_cues": [],
        "opening_character_state": "서윤은 자기 음료를 놓고 지안이 앉을 자리를 비워 둔다.",
        "opening_emotional_state": "기다림에 익숙한 편안함에서 조심스러운 걱정으로 이동한다.",
        "action_summary": "서윤이 약속 내용을 확인하고 답을 재촉하지 않는 연락을 남긴다. 집 앞에서 함께 출발할 수 있도록 직접 가 보기로 한다.",
        "audience_information_gain": "지안과 서윤의 정오 만남 약속이 있다. 현재 답이 없는 이유와 만남의 구체적인 목적은 아직 알 수 없다."
      },
      "units": [
        {
          "unit_id": "UNIT-01-001",
          "order": 1,
          "segment_id": "SEG-001",
          "type": "SCREEN_TEXT",
          "text": "본 이야기는 창작입니다.",
          "references": {
            "fact_ids": [],
            "clue_ids": [],
            "crime_event_ids": [],
            "harm_ids": [],
            "development_function_ids": [],
            "reveal_target_ids": []
          }
        },
        {
          "unit_id": "UNIT-01-002",
          "order": 2,
          "segment_id": "SEG-001",
          "type": "ACTION",
          "text": "서윤이 맞은편 의자에 놓았던 가방을 자기 발치로 옮긴다. 테이블을 닦은 티슈를 접어 치우고 음료 하나를 자기 쪽으로 당긴다. 다른 자리에 놓을 컵은 주문하지 않았다. 휴대전화를 꺼내 지안과 나눈 대화를 위로 올린다.",
          "references": {
            "fact_ids": [],
            "clue_ids": [],
            "crime_event_ids": [],
            "harm_ids": [],
            "development_function_ids": [],
            "reveal_target_ids": []
          }
        },
        {
          "unit_id": "UNIT-01-003",
          "order": 3,
          "segment_id": "SEG-001",
          "type": "MESSAGE",
          "text": "내일 정오에 카페에서 보자. 준비되면 연락할게. 먼저 도착하면 내 자리만 남겨 줘. 마실 건 내가 가서 고를게. 입구 바로 앞보다는 안쪽이 좋겠어. 거기서 만나서 얘기하자.",
          "references": {
            "fact_ids": [
              "FACT-04"
            ],
            "clue_ids": [],
            "crime_event_ids": [],
            "harm_ids": [],
            "development_function_ids": [],
            "reveal_target_ids": []
          },
          "speaker_id": "CHAR-01"
        },
        {
          "unit_id": "UNIT-01-004",
          "order": 4,
          "segment_id": "SEG-001",
          "type": "ACTION",
          "text": "서윤은 입력창에 도착했다는 말을 쓰고 보낸다. 카메라는 지안의 응답이나 읽음 여부를 만들어 보여 주지 않는다. 서윤이 자기 물컵을 옮겨 맞은편에 앉은 사람이 팔을 편히 놓을 공간을 만든다.",
          "references": {
            "fact_ids": [],
            "clue_ids": [],
            "crime_event_ids": [],
            "harm_ids": [],
            "development_function_ids": [],
            "reveal_target_ids": []
          }
        },
        {
          "unit_id": "UNIT-01-005",
          "order": 5,
          "segment_id": "SEG-001",
          "type": "MESSAGE",
          "text": "나 좀 일찍 왔어. 자리는 잡아 뒀고 네 건 오면 고르자. 약속은 정오 그대로야. 준비 끝나면 알려 줘. 집에서 같이 출발하는 게 편하면 내가 그쪽으로 갈게.",
          "references": {
            "fact_ids": [
              "FACT-04"
            ],
            "clue_ids": [],
            "crime_event_ids": [],
            "harm_ids": [],
            "development_function_ids": [],
            "reveal_target_ids": []
          },
          "speaker_id": "CHAR-03"
        },
        {
          "unit_id": "UNIT-01-006",
          "order": 6,
          "segment_id": "SEG-001",
          "type": "ACTION",
          "text": "서윤이 작업 가방에서 종이 묶음을 꺼내다가 다시 넣는다. 휴대전화를 아래로 뒤집었다가, 진동을 놓치지 않게 컵에서 떨어진 곳에 바로 놓는다. 출입문이 열리는 소리에 한 번 고개를 들지만 지안은 들어오지 않는다.",
          "references": {
            "fact_ids": [],
            "clue_ids": [],
            "crime_event_ids": [],
            "harm_ids": [],
            "development_function_ids": [],
            "reveal_target_ids": []
          }
        },
        {
          "unit_id": "UNIT-01-007",
          "order": 7,
          "segment_id": "SEG-001",
          "type": "INNER_MONOLOGUE",
          "text": "내가 먼저 왔잖아. 아직 늦은 것도 아닌데. 그냥 준비하고 있을 수도 있어. 지금 답이 없다고 약속이 없어진 건 아니잖아. 마음이 달라졌다면 지안한테 직접 들으면 돼. 내가 먼저 취소됐다고 정하고 돌아갈 일은 아니고.",
          "references": {
            "fact_ids": [
              "FACT-04"
            ],
            "clue_ids": [],
            "crime_event_ids": [],
            "harm_ids": [],
            "development_function_ids": [],
            "reveal_target_ids": []
          },
          "speaker_id": "CHAR-03"
        },
        {
          "unit_id": "UNIT-01-008",
          "order": 8,
          "segment_id": "SEG-001",
          "type": "ACTION",
          "text": "서윤이 통화를 건다. 연결을 기다리는 동안 가방 끈을 정리하고 컵 뚜껑을 닫는다. 통화가 이어지지 않자 종료한다. 이번에는 짧은 음성 메시지를 녹음한다. 서윤의 실제 발화가 화면과 동시에 들린다.",
          "references": {
            "fact_ids": [],
            "clue_ids": [],
            "crime_event_ids": [],
            "harm_ids": [],
            "development_function_ids": [],
            "reveal_target_ids": []
          }
        },
        {
          "unit_id": "UNIT-01-009",
          "order": 9,
          "segment_id": "SEG-001",
          "type": "DIALOGUE",
          "text": "지안아, 나야. 카페 소리가 좀 울리네. 급하게 나오라는 건 아니고, 내가 집 앞까지 갈게. 준비되면 같이 걸어오자. 혹시 혼자 가고 싶은 거면 그것도 말해 줘. 오늘 내가 필요한 자리가 어디까지인지 네가 정하면 돼. 답은 바로 안 해도 돼. 도착해서 한 번 더 부를게.",
          "references": {
            "fact_ids": [
              "FACT-04"
            ],
            "clue_ids": [],
            "crime_event_ids": [],
            "harm_ids": [],
            "development_function_ids": [],
            "reveal_target_ids": []
          },
          "speaker_id": "CHAR-03"
        },
        {
          "unit_id": "UNIT-01-010",
          "order": 10,
          "segment_id": "SEG-001",
          "type": "ACTION",
          "text": "서윤은 녹음 내용을 듣고 전송한다. 컵을 가방 옆 손에 들고 의자를 테이블 안으로 넣는다. 다시 연락이 왔는지 확인한 뒤 휴대전화를 손에 둔 채 카페를 나선다. 빈 의자를 바라보던 시선이 출입문 밖으로 옮겨 간다.",
          "references": {
            "fact_ids": [],
            "clue_ids": [],
            "crime_event_ids": [],
            "harm_ids": [],
            "development_function_ids": [],
            "reveal_target_ids": []
          }
        }
      ]
    },
    {
      "scene_id": "SCN-02",
      "order": 2,
      "title": "둘이 고른 아침",
      "time_layer": "FLASHBACK",
      "location_id": "LOC-01",
      "segment_ids": [
        "SEG-002",
        "SEG-003",
        "SEG-004"
      ],
      "context": {
        "location_description": "지안의 집. 작은 식탁 옆에 서로 닮은 겉옷 두 벌이 걸려 있다.",
        "time_description": "사건 전날보다 앞선 과거 오전 8시.",
        "previous_scene_id": "SCN-01",
        "background_music_description": "대화와 생활 소리가 선명하게 들리도록 음악을 두지 않는다.",
        "sound_cues": [],
        "opening_character_state": "지안과 도윤이 식사 준비를 마친다.",
        "opening_emotional_state": "가까워지고 싶은 마음에 생긴 가벼운 어긋남.",
        "action_summary": "같은 음식과 옷, 잠드는 시간과 공동 알림이 제안된다. 지안의 다른 선택은 말끝에서 작아진다.",
        "audience_information_gain": "맞추는 생활과 공동 알림을 본다. 화면은 합의의 진위나 기록의 증명력을 결론 내리지 않는다."
      },
      "units": [
        {
          "unit_id": "UNIT-02-001",
          "order": 1,
          "segment_id": "SEG-002",
          "type": "ACTION",
          "text": "지안이 찬장에서 작은 그릇을 꺼낸다. 도윤은 이미 차려 놓은 두 접시를 나란히 당기고 지안의 자리에 숟가락을 놓는다. 지안이 꺼낸 그릇은 식탁 가장자리에 남는다.",
          "references": {
            "fact_ids": [],
            "clue_ids": [],
            "crime_event_ids": [],
            "harm_ids": [],
            "development_function_ids": [],
            "reveal_target_ids": []
          }
        },
        {
          "unit_id": "UNIT-02-002",
          "order": 2,
          "segment_id": "SEG-002",
          "type": "DIALOGUE",
          "text": "오늘은 나랑 같은 거 먹어 보자. 둘이 따로 하면 설거지도 늘고, 같이 앉는 시간이 자꾸 짧아지잖아.",
          "references": {
            "fact_ids": [
              "FACT-01"
            ],
            "clue_ids": [],
            "crime_event_ids": [],
            "harm_ids": [],
            "development_function_ids": [],
            "reveal_target_ids": []
          },
          "speaker_id": "CHAR-02"
        },
        {
          "unit_id": "UNIT-02-003",
          "order": 3,
          "segment_id": "SEG-002",
          "type": "DIALOGUE",
          "text": "나는 아침엔 국물 있는 게 좋은데. 한 숟갈만 먹고 내 걸 데워도 돼?",
          "references": {
            "fact_ids": [
              "FACT-01"
            ],
            "clue_ids": [],
            "crime_event_ids": [],
            "harm_ids": [],
            "development_function_ids": [],
            "reveal_target_ids": []
          },
          "speaker_id": "CHAR-01"
        },
        {
          "unit_id": "UNIT-02-004",
          "order": 4,
          "segment_id": "SEG-002",
          "type": "DIALOGUE",
          "text": "일단 먹어 봐. 네 것도 생각해서 한 건데. 옷은 저기 걸어 놨어. 오늘 같이 입으면 예쁠 것 같아서.",
          "references": {
            "fact_ids": [
              "FACT-01"
            ],
            "clue_ids": [],
            "crime_event_ids": [],
            "harm_ids": [],
            "development_function_ids": [],
            "reveal_target_ids": []
          },
          "speaker_id": "CHAR-02"
        },
        {
          "unit_id": "UNIT-02-005",
          "order": 5,
          "segment_id": "SEG-002",
          "type": "ACTION",
          "text": "지안은 식탁 옆 두 겉옷을 보고 웃는다. 한 벌의 소매를 대 보다가 제자리에 건다. 공동 알림이 두 휴대전화에서 잇달아 울린다.",
          "references": {
            "fact_ids": [],
            "clue_ids": [
              "CLUE-04"
            ],
            "crime_event_ids": [],
            "harm_ids": [],
            "development_function_ids": [],
            "reveal_target_ids": []
          }
        },
        {
          "unit_id": "UNIT-02-006",
          "order": 6,
          "segment_id": "SEG-002",
          "type": "SCREEN_TEXT",